tcpdump: data link type LINUX_SLL2
tcpdump: verbose output suppressed, use -v[v]... for full protocol decode
listening on any, link-type LINUX_SLL2 (Linux cooked v2), snapshot length 262144 bytes
06:19:50.539059 eth0  In  ifindex 2 ee:ee:ee:ee:ee:ee ethertype IPv4 (0x0800), length 80: 10.233.102.128.49180 > 10.233.64.253.80: Flags [S], seq 3395946580, win 32430, options [mss 1410,sackOK,TS val 2795243961 ecr 0,nop,wscale 7], length 0
06:19:50.539102 eth0  Out ifindex 2 1a:05:3c:13:ef:9c ethertype IPv4 (0x0800), length 80: 10.233.64.253.80 > 10.233.102.128.49180: Flags [S.], seq 1380939513, ack 3395946581, win 32154, options [mss 1410,sackOK,TS val 2248201893 ecr 2795243961,nop,wscale 7], length 0
06:19:50.541818 eth0  In  ifindex 2 ee:ee:ee:ee:ee:ee ethertype IPv4 (0x0800), length 72: 10.233.102.128.49180 > 10.233.64.253.80: Flags [.], ack 1, win 254, options [nop,nop,TS val 2795243964 ecr 2248201893], length 0
06:19:50.542743 eth0  In  ifindex 2 ee:ee:ee:ee:ee:ee ethertype IPv4 (0x0800), length 148: 10.233.102.128.49180 > 10.233.64.253.80: Flags [P.], seq 1:77, ack 1, win 254, options [nop,nop,TS val 2795243964 ecr 2248201893], length 76: HTTP: GET / HTTP/1.1
06:19:50.542771 eth0  Out ifindex 2 1a:05:3c:13:ef:9c ethertype IPv4 (0x0800), length 72: 10.233.64.253.80 > 10.233.102.128.49180: Flags [.], ack 77, win 251, options [nop,nop,TS val 2248201897 ecr 2795243964], length 0
06:19:50.543068 eth0  Out ifindex 2 1a:05:3c:13:ef:9c ethertype IPv4 (0x0800), length 922: 10.233.64.253.80 > 10.233.102.128.49180: Flags [P.], seq 1:851, ack 77, win 251, options [nop,nop,TS val 2248201897 ecr 2795243964], length 850: HTTP: HTTP/1.1 200 OK
06:19:50.546011 eth0  In  ifindex 2 ee:ee:ee:ee:ee:ee ethertype IPv4 (0x0800), length 72: 10.233.102.128.49180 > 10.233.64.253.80: Flags [.], ack 851, win 250, options [nop,nop,TS val 2795243968 ecr 2248201897], length 0
06:19:50.546025 eth0  In  ifindex 2 ee:ee:ee:ee:ee:ee ethertype IPv4 (0x0800), length 72: 10.233.102.128.49180 > 10.233.64.253.80: Flags [F.], seq 77, ack 851, win 250, options [nop,nop,TS val 2795243968 ecr 2248201897], length 0
06:19:50.546112 eth0  Out ifindex 2 1a:05:3c:13:ef:9c ethertype IPv4 (0x0800), length 72: 10.233.64.253.80 > 10.233.102.128.49180: Flags [F.], seq 851, ack 78, win 251, options [nop,nop,TS val 2248201900 ecr 2795243968], length 0
06:19:50.548156 eth0  In  ifindex 2 ee:ee:ee:ee:ee:ee ethertype IPv4 (0x0800), length 72: 10.233.102.128.49180 > 10.233.64.253.80: Flags [.], ack 852, win 250, options [nop,nop,TS val 2795243970 ecr 2248201900], length 0
06:19:52.123993 eth0  In  ifindex 2 ee:ee:ee:ee:ee:ee ethertype IPv4 (0x0800), length 80: 10.233.102.128.40274 > 10.233.64.253.80: Flags [S], seq 2400156185, win 32430, options [mss 1410,sackOK,TS val 2795245546 ecr 0,nop,wscale 7], length 0
06:19:52.124019 eth0  Out ifindex 2 1a:05:3c:13:ef:9c ethertype IPv4 (0x0800), length 80: 10.233.64.253.80 > 10.233.102.128.40274: Flags [S.], seq 3510251125, ack 2400156186, win 32154, options [mss 1410,sackOK,TS val 2248203478 ecr 2795245546,nop,wscale 7], length 0
06:19:52.126774 eth0  In  ifindex 2 ee:ee:ee:ee:ee:ee ethertype IPv4 (0x0800), length 72: 10.233.102.128.40274 > 10.233.64.253.80: Flags [.], ack 1, win 254, options [nop,nop,TS val 2795245549 ecr 2248203478], length 0
06:19:52.126778 eth0  In  ifindex 2 ee:ee:ee:ee:ee:ee ethertype IPv4 (0x0800), length 148: 10.233.102.128.40274 > 10.233.64.253.80: Flags [P.], seq 1:77, ack 1, win 254, options [nop,nop,TS val 2795245549 ecr 2248203478], length 76: HTTP: GET / HTTP/1.1
06:19:52.126818 eth0  Out ifindex 2 1a:05:3c:13:ef:9c ethertype IPv4 (0x0800), length 72: 10.233.64.253.80 > 10.233.102.128.40274: Flags [.], ack 77, win 251, options [nop,nop,TS val 2248203481 ecr 2795245549], length 0
06:19:52.127020 eth0  Out ifindex 2 1a:05:3c:13:ef:9c ethertype IPv4 (0x0800), length 922: 10.233.64.253.80 > 10.233.102.128.40274: Flags [P.], seq 1:851, ack 77, win 251, options [nop,nop,TS val 2248203481 ecr 2795245549], length 850: HTTP: HTTP/1.1 200 OK
06:19:52.129190 eth0  In  ifindex 2 ee:ee:ee:ee:ee:ee ethertype IPv4 (0x0800), length 72: 10.233.102.128.40274 > 10.233.64.253.80: Flags [.], ack 851, win 250, options [nop,nop,TS val 2795245551 ecr 2248203481], length 0
06:19:52.129924 eth0  In  ifindex 2 ee:ee:ee:ee:ee:ee ethertype IPv4 (0x0800), length 72: 10.233.102.128.40274 > 10.233.64.253.80: Flags [F.], seq 77, ack 851, win 250, options [nop,nop,TS val 2795245552 ecr 2248203481], length 0
06:19:52.129956 eth0  Out ifindex 2 1a:05:3c:13:ef:9c ethertype IPv4 (0x0800), length 72: 10.233.64.253.80 > 10.233.102.128.40274: Flags [F.], seq 851, ack 78, win 251, options [nop,nop,TS val 2248203484 ecr 2795245552], length 0
06:19:52.132036 eth0  In  ifindex 2 ee:ee:ee:ee:ee:ee ethertype IPv4 (0x0800), length 72: 10.233.102.128.40274 > 10.233.64.253.80: Flags [.], ack 852, win 250, options [nop,nop,TS val 2795245554 ecr 2248203484], length 0
06:19:52.588130 eth0  In  ifindex 2 ee:ee:ee:ee:ee:ee ethertype IPv4 (0x0800), length 80: 10.233.102.128.40276 > 10.233.64.253.80: Flags [S], seq 3440150792, win 32430, options [mss 1410,sackOK,TS val 2795246009 ecr 0,nop,wscale 7], length 0
06:19:52.588153 eth0  Out ifindex 2 1a:05:3c:13:ef:9c ethertype IPv4 (0x0800), length 80: 10.233.64.253.80 > 10.233.102.128.40276: Flags [S.], seq 184901252, ack 3440150793, win 32154, options [mss 1410,sackOK,TS val 2248203942 ecr 2795246009,nop,wscale 7], length 0
06:19:52.590650 eth0  In  ifindex 2 ee:ee:ee:ee:ee:ee ethertype IPv4 (0x0800), length 72: 10.233.102.128.40276 > 10.233.64.253.80: Flags [.], ack 1, win 254, options [nop,nop,TS val 2795246013 ecr 2248203942], length 0
06:19:52.590704 eth0  In  ifindex 2 ee:ee:ee:ee:ee:ee ethertype IPv4 (0x0800), length 148: 10.233.102.128.40276 > 10.233.64.253.80: Flags [P.], seq 1:77, ack 1, win 254, options [nop,nop,TS val 2795246013 ecr 2248203942], length 76: HTTP: GET / HTTP/1.1
06:19:52.590711 eth0  Out ifindex 2 1a:05:3c:13:ef:9c ethertype IPv4 (0x0800), length 72: 10.233.64.253.80 > 10.233.102.128.40276: Flags [.], ack 77, win 251, options [nop,nop,TS val 2248203945 ecr 2795246013], length 0
06:19:52.590894 eth0  Out ifindex 2 1a:05:3c:13:ef:9c ethertype IPv4 (0x0800), length 922: 10.233.64.253.80 > 10.233.102.128.40276: Flags [P.], seq 1:851, ack 77, win 251, options [nop,nop,TS val 2248203945 ecr 2795246013], length 850: HTTP: HTTP/1.1 200 OK
06:19:52.593211 eth0  In  ifindex 2 ee:ee:ee:ee:ee:ee ethertype IPv4 (0x0800), length 72: 10.233.102.128.40276 > 10.233.64.253.80: Flags [.], ack 851, win 250, options [nop,nop,TS val 2795246015 ecr 2248203945], length 0
06:19:52.593256 eth0  In  ifindex 2 ee:ee:ee:ee:ee:ee ethertype IPv4 (0x0800), length 72: 10.233.102.128.40276 > 10.233.64.253.80: Flags [.], ack 851, win 250, options [nop,nop,TS val 2795246015 ecr 2248203945], length 0
06:19:52.595362 eth0  In  ifindex 2 ee:ee:ee:ee:ee:ee ethertype IPv4 (0x0800), length 72: 10.233.102.128.40276 > 10.233.64.253.80: Flags [F.], seq 77, ack 851, win 250, options [nop,nop,TS val 2795246016 ecr 2248203945], length 0
06:19:52.595392 eth0  Out ifindex 2 1a:05:3c:13:ef:9c ethertype IPv4 (0x0800), length 72: 10.233.64.253.80 > 10.233.102.128.40276: Flags [F.], seq 851, ack 78, win 251, options [nop,nop,TS val 2248203949 ecr 2795246016], length 0
06:19:52.597685 eth0  In  ifindex 2 ee:ee:ee:ee:ee:ee ethertype IPv4 (0x0800), length 72: 10.233.102.128.40276 > 10.233.64.253.80: Flags [.], ack 852, win 250, options [nop,nop,TS val 2795246020 ecr 2248203949], length 0
06:19:52.928219 eth0  In  ifindex 2 ee:ee:ee:ee:ee:ee ethertype IPv4 (0x0800), length 80: 10.233.102.128.40278 > 10.233.64.253.80: Flags [S], seq 4089023250, win 32430, options [mss 1410,sackOK,TS val 2795246350 ecr 0,nop,wscale 7], length 0
06:19:52.928252 eth0  Out ifindex 2 1a:05:3c:13:ef:9c ethertype IPv4 (0x0800), length 80: 10.233.64.253.80 > 10.233.102.128.40278: Flags [S.], seq 659791451, ack 4089023251, win 32154, options [mss 1410,sackOK,TS val 2248204282 ecr 2795246350,nop,wscale 7], length 0
06:19:52.930867 eth0  In  ifindex 2 ee:ee:ee:ee:ee:ee ethertype IPv4 (0x0800), length 72: 10.233.102.128.40278 > 10.233.64.253.80: Flags [.], ack 1, win 254, options [nop,nop,TS val 2795246353 ecr 2248204282], length 0
06:19:52.930872 eth0  In  ifindex 2 ee:ee:ee:ee:ee:ee ethertype IPv4 (0x0800), length 148: 10.233.102.128.40278 > 10.233.64.253.80: Flags [P.], seq 1:77, ack 1, win 254, options [nop,nop,TS val 2795246353 ecr 2248204282], length 76: HTTP: GET / HTTP/1.1
06:19:52.930903 eth0  Out ifindex 2 1a:05:3c:13:ef:9c ethertype IPv4 (0x0800), length 72: 10.233.64.253.80 > 10.233.102.128.40278: Flags [.], ack 77, win 251, options [nop,nop,TS val 2248204285 ecr 2795246353], length 0
06:19:52.931065 eth0  Out ifindex 2 1a:05:3c:13:ef:9c ethertype IPv4 (0x0800), length 922: 10.233.64.253.80 > 10.233.102.128.40278: Flags [P.], seq 1:851, ack 77, win 251, options [nop,nop,TS val 2248204285 ecr 2795246353], length 850: HTTP: HTTP/1.1 200 OK
06:19:52.933174 eth0  In  ifindex 2 ee:ee:ee:ee:ee:ee ethertype IPv4 (0x0800), length 72: 10.233.102.128.40278 > 10.233.64.253.80: Flags [.], ack 851, win 250, options [nop,nop,TS val 2795246355 ecr 2248204285], length 0
06:19:52.936095 eth0  In  ifindex 2 ee:ee:ee:ee:ee:ee ethertype IPv4 (0x0800), length 72: 10.233.102.128.40278 > 10.233.64.253.80: Flags [F.], seq 77, ack 851, win 250, options [nop,nop,TS val 2795246357 ecr 2248204285], length 0
06:19:52.936125 eth0  Out ifindex 2 1a:05:3c:13:ef:9c ethertype IPv4 (0x0800), length 72: 10.233.64.253.80 > 10.233.102.128.40278: Flags [F.], seq 851, ack 78, win 251, options [nop,nop,TS val 2248204290 ecr 2795246357], length 0
06:19:52.938755 eth0  In  ifindex 2 ee:ee:ee:ee:ee:ee ethertype IPv4 (0x0800), length 72: 10.233.102.128.40278 > 10.233.64.253.80: Flags [.], ack 852, win 250, options [nop,nop,TS val 2795246360 ecr 2248204290], length 0
06:19:53.215079 eth0  In  ifindex 2 ee:ee:ee:ee:ee:ee ethertype IPv4 (0x0800), length 80: 10.233.102.128.40286 > 10.233.64.253.80: Flags [S], seq 2348874007, win 32430, options [mss 1410,sackOK,TS val 2795246637 ecr 0,nop,wscale 7], length 0
06:19:53.215105 eth0  Out ifindex 2 1a:05:3c:13:ef:9c ethertype IPv4 (0x0800), length 80: 10.233.64.253.80 > 10.233.102.128.40286: Flags [S.], seq 985247516, ack 2348874008, win 32154, options [mss 1410,sackOK,TS val 2248204569 ecr 2795246637,nop,wscale 7], length 0
06:19:53.217514 eth0  In  ifindex 2 ee:ee:ee:ee:ee:ee ethertype IPv4 (0x0800), length 72: 10.233.102.128.40286 > 10.233.64.253.80: Flags [.], ack 1, win 254, options [nop,nop,TS val 2795246640 ecr 2248204569], length 0
06:19:53.217579 eth0  In  ifindex 2 ee:ee:ee:ee:ee:ee ethertype IPv4 (0x0800), length 148: 10.233.102.128.40286 > 10.233.64.253.80: Flags [P.], seq 1:77, ack 1, win 254, options [nop,nop,TS val 2795246640 ecr 2248204569], length 76: HTTP: GET / HTTP/1.1
06:19:53.217585 eth0  Out ifindex 2 1a:05:3c:13:ef:9c ethertype IPv4 (0x0800), length 72: 10.233.64.253.80 > 10.233.102.128.40286: Flags [.], ack 77, win 251, options [nop,nop,TS val 2248204572 ecr 2795246640], length 0
06:19:53.217762 eth0  Out ifindex 2 1a:05:3c:13:ef:9c ethertype IPv4 (0x0800), length 922: 10.233.64.253.80 > 10.233.102.128.40286: Flags [P.], seq 1:851, ack 77, win 251, options [nop,nop,TS val 2248204572 ecr 2795246640], length 850: HTTP: HTTP/1.1 200 OK
06:19:53.219983 eth0  In  ifindex 2 ee:ee:ee:ee:ee:ee ethertype IPv4 (0x0800), length 72: 10.233.102.128.40286 > 10.233.64.253.80: Flags [.], ack 851, win 250, options [nop,nop,TS val 2795246642 ecr 2248204572], length 0
06:19:53.220192 eth0  In  ifindex 2 ee:ee:ee:ee:ee:ee ethertype IPv4 (0x0800), length 72: 10.233.102.128.40286 > 10.233.64.253.80: Flags [F.], seq 77, ack 851, win 250, options [nop,nop,TS val 2795246643 ecr 2248204572], length 0
06:19:53.220238 eth0  Out ifindex 2 1a:05:3c:13:ef:9c ethertype IPv4 (0x0800), length 72: 10.233.64.253.80 > 10.233.102.128.40286: Flags [F.], seq 851, ack 78, win 251, options [nop,nop,TS val 2248204574 ecr 2795246643], length 0
06:19:53.222429 eth0  In  ifindex 2 ee:ee:ee:ee:ee:ee ethertype IPv4 (0x0800), length 72: 10.233.102.128.40286 > 10.233.64.253.80: Flags [.], ack 852, win 250, options [nop,nop,TS val 2795246645 ecr 2248204574], length 0
06:19:53.473850 eth0  In  ifindex 2 ee:ee:ee:ee:ee:ee ethertype IPv4 (0x0800), length 80: 10.233.102.128.40300 > 10.233.64.253.80: Flags [S], seq 72636887, win 32430, options [mss 1410,sackOK,TS val 2795246895 ecr 0,nop,wscale 7], length 0
06:19:53.473871 eth0  Out ifindex 2 1a:05:3c:13:ef:9c ethertype IPv4 (0x0800), length 80: 10.233.64.253.80 > 10.233.102.128.40300: Flags [S.], seq 3361287202, ack 72636888, win 32154, options [mss 1410,sackOK,TS val 2248204828 ecr 2795246895,nop,wscale 7], length 0
06:19:53.476825 eth0  In  ifindex 2 ee:ee:ee:ee:ee:ee ethertype IPv4 (0x0800), length 148: 10.233.102.128.40300 > 10.233.64.253.80: Flags [P.], seq 1:77, ack 1, win 254, options [nop,nop,TS val 2795246899 ecr 2248204828], length 76: HTTP: GET / HTTP/1.1
06:19:53.476851 eth0  Out ifindex 2 1a:05:3c:13:ef:9c ethertype IPv4 (0x0800), length 72: 10.233.64.253.80 > 10.233.102.128.40300: Flags [.], ack 77, win 251, options [nop,nop,TS val 2248204831 ecr 2795246899], length 0
06:19:53.476830 eth0  In  ifindex 2 ee:ee:ee:ee:ee:ee ethertype IPv4 (0x0800), length 72: 10.233.102.128.40300 > 10.233.64.253.80: Flags [.], ack 1, win 254, options [nop,nop,TS val 2795246899 ecr 2248204828], length 0
06:19:53.476866 eth0  Out ifindex 2 1a:05:3c:13:ef:9c ethertype IPv4 (0x0800), length 72: 10.233.64.253.80 > 10.233.102.128.40300: Flags [.], ack 77, win 251, options [nop,nop,TS val 2248204831 ecr 2795246899], length 0
06:19:53.477024 eth0  Out ifindex 2 1a:05:3c:13:ef:9c ethertype IPv4 (0x0800), length 922: 10.233.64.253.80 > 10.233.102.128.40300: Flags [P.], seq 1:851, ack 77, win 251, options [nop,nop,TS val 2248204831 ecr 2795246899], length 850: HTTP: HTTP/1.1 200 OK
06:19:53.479498 eth0  In  ifindex 2 ee:ee:ee:ee:ee:ee ethertype IPv4 (0x0800), length 72: 10.233.102.128.40300 > 10.233.64.253.80: Flags [.], ack 851, win 250, options [nop,nop,TS val 2795246901 ecr 2248204831], length 0
06:19:53.479502 eth0  In  ifindex 2 ee:ee:ee:ee:ee:ee ethertype IPv4 (0x0800), length 72: 10.233.102.128.40300 > 10.233.64.253.80: Flags [F.], seq 77, ack 851, win 250, options [nop,nop,TS val 2795246902 ecr 2248204831], length 0
06:19:53.479545 eth0  Out ifindex 2 1a:05:3c:13:ef:9c ethertype IPv4 (0x0800), length 72: 10.233.64.253.80 > 10.233.102.128.40300: Flags [F.], seq 851, ack 78, win 251, options [nop,nop,TS val 2248204833 ecr 2795246902], length 0
06:19:53.482326 eth0  In  ifindex 2 ee:ee:ee:ee:ee:ee ethertype IPv4 (0x0800), length 72: 10.233.102.128.40300 > 10.233.64.253.80: Flags [.], ack 852, win 250, options [nop,nop,TS val 2795246904 ecr 2248204833], length 0
06:19:54.265424 eth0  In  ifindex 2 ee:ee:ee:ee:ee:ee ethertype IPv4 (0x0800), length 80: 10.233.102.128.40304 > 10.233.64.253.80: Flags [S], seq 1917844259, win 32430, options [mss 1410,sackOK,TS val 2795247687 ecr 0,nop,wscale 7], length 0
06:19:54.265446 eth0  Out ifindex 2 1a:05:3c:13:ef:9c ethertype IPv4 (0x0800), length 80: 10.233.64.253.80 > 10.233.102.128.40304: Flags [S.], seq 327120835, ack 1917844260, win 32154, options [mss 1410,sackOK,TS val 2248205619 ecr 2795247687,nop,wscale 7], length 0
06:19:54.268007 eth0  In  ifindex 2 ee:ee:ee:ee:ee:ee ethertype IPv4 (0x0800), length 72: 10.233.102.128.40304 > 10.233.64.253.80: Flags [.], ack 1, win 254, options [nop,nop,TS val 2795247690 ecr 2248205619], length 0
06:19:54.268407 eth0  In  ifindex 2 ee:ee:ee:ee:ee:ee ethertype IPv4 (0x0800), length 148: 10.233.102.128.40304 > 10.233.64.253.80: Flags [P.], seq 1:77, ack 1, win 254, options [nop,nop,TS val 2795247691 ecr 2248205619], length 76: HTTP: GET / HTTP/1.1
06:19:54.268421 eth0  Out ifindex 2 1a:05:3c:13:ef:9c ethertype IPv4 (0x0800), length 72: 10.233.64.253.80 > 10.233.102.128.40304: Flags [.], ack 77, win 251, options [nop,nop,TS val 2248205622 ecr 2795247691], length 0
06:19:54.268530 eth0  Out ifindex 2 1a:05:3c:13:ef:9c ethertype IPv4 (0x0800), length 922: 10.233.64.253.80 > 10.233.102.128.40304: Flags [P.], seq 1:851, ack 77, win 251, options [nop,nop,TS val 2248205622 ecr 2795247691], length 850: HTTP: HTTP/1.1 200 OK
06:19:54.271083 eth0  In  ifindex 2 ee:ee:ee:ee:ee:ee ethertype IPv4 (0x0800), length 72: 10.233.102.128.40304 > 10.233.64.253.80: Flags [.], ack 851, win 250, options [nop,nop,TS val 2795247693 ecr 2248205622], length 0
06:19:54.271438 eth0  In  ifindex 2 ee:ee:ee:ee:ee:ee ethertype IPv4 (0x0800), length 72: 10.233.102.128.40304 > 10.233.64.253.80: Flags [F.], seq 77, ack 851, win 250, options [nop,nop,TS val 2795247694 ecr 2248205622], length 0
06:19:54.271480 eth0  Out ifindex 2 1a:05:3c:13:ef:9c ethertype IPv4 (0x0800), length 72: 10.233.64.253.80 > 10.233.102.128.40304: Flags [F.], seq 851, ack 78, win 251, options [nop,nop,TS val 2248205625 ecr 2795247694], length 0
06:19:54.273583 eth0  In  ifindex 2 ee:ee:ee:ee:ee:ee ethertype IPv4 (0x0800), length 72: 10.233.102.128.40304 > 10.233.64.253.80: Flags [.], ack 852, win 250, options [nop,nop,TS val 2795247696 ecr 2248205625], length 0